username,score,at,content,thumbsupcount,has_pembayaran,has_driver,has_aplikasi,has_harga,has_layanan,has_order,has_waktu,has_lokasi,has_komunikasi,has_umum,clean_text,label
Dewi Sartika,5,2025-10-05 20:58:54,peta nya gak familiar susah pakainya klo untuk cari alamat overal tarifnya paling murah diantara ojol lainnya,0,0,0,0,1,0,0,0,0,0,0,peta nya gak familiar susah pakainya klo cari alamat overal tarifnya murah ojol,puas
Atien Sie,5,2025-10-05 19:34:55,cepat,0,0,0,0,0,0,0,1,0,0,0,cepat,puas
Lia Emon,2,2025-10-05 17:54:48,tidak bisa menggunakan kaspro sdh diganti malah ga terbayar kan sia sia masukin uang ke kaspro,0,1,0,1,0,0,0,0,0,0,0,kaspro sdh diganti ga terbayar sia sia masukin uang kaspro,netral
Haryo Sastronegoro,5,2025-10-05 15:36:36,okay,0,0,0,0,0,0,0,0,0,0,0,okay,netral
Penyelamat War,1,2025-10-05 15:22:03,parah delivery maxim ojek nya bawa lari pesanan saya sekarang mau di laporin gak bisa nyesal pakai maxim tidak aman,0,0,1,0,0,1,1,0,0,0,1,parah delivery maxim ojek nya bawa lari pesanan laporin gak nyesal pakai maxim aman,tidak puas
wayangmlmantigalau wayangmlmantigalau123,5,2025-10-05 15:09:54,ok bgs,0,0,0,0,0,0,0,0,0,0,1,ok bgs,netral
Herry CMN#27,5,2025-10-05 14:59:45,masya allah,0,0,0,0,0,0,0,0,0,0,0,masya allah,netral
Amalia Sarah,2,2025-10-05 13:40:36,sangat disayangkan sebulan terakhir saya pakai maxim supirnya sangat mengecewakan supir nya juga ngak ramah bawa motornya juga ngak enak ingin kasih rating saat itu sudah terlambat tolong donk pihak manajemen driver motornya dikasih edukasi,3,0,1,0,0,1,0,1,0,0,1,disayangkan sebulan pakai maxim supirnya mengecewakan supir nya ngak ramah bawa motornya ngak enak kasih rating terlambat tolong donk manajemen driver motornya dikasih edukasi,tidak puas
lisa dumbi,1,2025-10-05 13:39:57,driver belagu semua apalagi driver gorontalo gmending pakai grab,0,0,1,0,0,0,0,0,0,0,0,driver belagu driver gorontalo gmending pakai grab,netral
Ulil ilmi,1,2025-10-05 12:52:44,login nya susah kirim kode nggk dikirim2 batas waktu login sangat limit padahal darurat,1,0,0,1,1,0,0,0,0,0,0,login nya susah kirim kode nggk dikirim batas login limit darurat,tidak puas
hengki menandri,3,2025-10-05 11:59:39,pilihan tepat untul buru2 tapi kok error muluu,0,0,0,1,0,0,0,0,0,0,0,pilihan untul buru error muluu,tidak puas
Herman Sugiyanto,5,2025-10-05 11:57:54,memuaskan,0,0,0,0,0,0,0,0,0,0,0,memuaskan,netral
Sakinah,2,2025-10-05 11:23:42,dapat pengemidi lama skali 1 smpai 2 jam bru dapat apalagi kalau hujan,0,0,0,0,0,0,0,1,0,0,0,pengemidi skali smpai jam bru hujan,netral
Eko Prasettiyo,2,2025-10-05 10:37:08,pengisian e wallet nya super lamaaaa buang2 waktu,0,0,0,0,0,0,0,0,0,0,0,pengisian e wallet nya super lamaaaa buang,netral
Syadeli,5,2025-10-05 09:19:17,sangt bermanfaat tksi,0,0,0,0,0,0,0,0,0,0,0,sangt bermanfaat tksi,netral
Uun Dian Aprillia 04,1,2025-10-05 08:16:37,banyak driver yg kasar kalau customer kurang paham kondisi jalan bisa sampai memaki customer padahal customer ngga tau kondisi jalan yang bakal di lewati itu macet atau tidak saran mungkin untuk pemilihan drivernya dn sistem pembayaran menggunakan maxim wallet dapat ditingkatkan,0,1,1,1,0,1,0,0,0,0,0,driver yg kasar customer paham kondisi jalan memaki customer customer ngga tau kondisi jalan lewati macet saran pemilihan drivernya dn sistem pembayaran maxim wallet ditingkatkan,netral
Firman manno,1,2025-10-05 08:02:39,tolong ditindak untuk driver mobil disuruh tunggu ketika ditunggu malah nge batalin sendiri jelek banget kualitas maxim mobil,0,0,1,0,0,0,0,0,0,0,1,tolong ditindak driver mobil disuruh tunggu ditunggu nge batalin jelek banget kualitas maxim mobil,tidak puas
Glory Caroline,1,2025-10-05 07:35:47,ga bagus untuk pembatalan orderan tidak ada sangat membuat customer bingung bintang 1,0,0,0,0,0,0,0,0,0,0,1,ga bagus pembatalan orderan customer bingung bintang,puas
nafila firda,1,2025-10-05 07:28:05,lamaaa poullll nunggu orderannya diambill,0,0,0,0,0,0,0,1,0,0,0,lamaaa poullll nunggu orderannya diambill,netral
Wawan Kurniawan,5,2025-10-05 07:27:58,sudah bagus hanya saja patokan lokasi kurang,0,0,0,0,0,0,0,0,1,0,1,bagus patokan lokasi,puas
ZZ pane,2,2025-10-05 07:13:03,kecewa sih sya menggunakan jasa delivery brang sudah sma kurir beserta ongkir sudah dibawar tpi tiba2 orderan hilang dan brang tidak diantar atau dikembalikan jjur gak ikhlas krena bukan masalah berapa nominalnya tapi sbgai penjual itu brang gak nyampe ke kostumer dn berpengaruh ke toko saya tolong respon feedback saya sya mau riwayat orderan terakhir sya dichek ulang,0,1,1,0,0,0,1,0,0,0,1,kecewa sih sya jasa delivery brang sma kurir beserta ongkir dibawar tpi orderan hilang brang diantar dikembalikan jjur gak ikhlas krena nominalnya sbgai penjual brang gak nyampe kostumer dn berpengaruh toko tolong respon feedback sya riwayat orderan sya dichek ulang,tidak puas
Agustinus Widiatmoko,3,2025-10-05 06:57:51,kenapa riwayat order tidak terlihat,0,0,0,0,0,0,1,0,0,0,0,riwayat order,netral
Doni acuy official,4,2025-10-05 04:53:23,pada niat narik ga ni driver mobil susah bener pesen,0,0,1,0,0,0,0,0,0,0,0,niat narik ga ni driver mobil susah bener pesen,tidak puas
Dita Julianti,1,2025-10-05 03:15:29,semua driver alasannya selalu jauh dan selalu mnta cancel pdhl kita ini tauji baca maps bukan ji orang tidak tau membaca,0,0,1,1,0,0,0,0,1,0,0,driver alasannya mnta cancel pdhl tauji baca maps ji orang tau membaca,netral
Mputt Cemongg,3,2025-10-05 02:47:11,aneh tiap order driver car gapernah di terima oleh driver padahl saya bayar ga numpang,0,1,1,0,0,0,1,0,0,0,0,aneh order driver car gapernah terima driver padahl bayar ga numpang,netral
Arifin Sul,5,2025-10-05 02:25:57,buat penumpang dan pemesan delivery di aplikasi ini jangan pelit dan kikir mesan mobil delivery tarif di aplikasi memang murah meriah tapi siapa juga yg mau ambil orderan dgn tarif 30ribuan jarak 15km kan tolol minimal elu pasang kek 4500 per km,2,0,0,0,1,0,0,0,0,0,0,penumpang pemesan delivery aplikasi pelit kikir mesan mobil delivery tarif aplikasi murah meriah yg ambil orderan dgn tarif ribuan jarak km tolol minimal elu pasang kek km,puas
Badrudin Uday,1,2025-10-05 02:06:09,padahal di akun maxim masih ada saldo nya tapi ga tau knp tiba akun nya ga bisa di login lagi mohon dibuka akun saya kembali soal nya masih ada saldo nya di akun nya,0,1,0,1,0,0,0,0,0,0,0,akun maxim saldo nya ga tau knp akun nya ga login mohon dibuka akun nya saldo nya akun nya,netral
Delima Sari,2,2025-10-05 00:35:42,maxim wallet diisi tapi ga bisa digunakan ga ada driver yg mau pake maxim wallet saldo ga bisa ditarik karena ga ada fitur nya,0,1,1,1,0,0,0,0,0,0,0,maxim wallet diisi ga ga driver yg pake maxim wallet saldo ga ditarik ga fitur nya,netral
Rafli Akbar,1,2025-10-04 15:51:17,ongkir maxinfood kau mahal kali bah 5k jadi 30k,0,0,0,0,1,0,0,0,0,0,0,ongkir maxinfood kau mahal kali bah k k,netral
Marsel 123,1,2025-10-04 15:36:51,tolonglah di perbaikin lg nyari almat aja ngga ketemu trs map ny juga muter ngga jelas,0,0,0,0,0,0,0,0,0,0,0,tolonglah perbaikin lg nyari almat aja ngga ketemu trs map ny muter ngga,netral
Elsa Ratnasari Panggabean,2,2025-10-04 14:04:58,untuk apa dibuat pembayaran non tunai tapi driver selalu mintak cencel karna pembayarnnya mereka tidak terima kalau melalui wallet kaspro menciptakan pembayaran non tunai tapi driver yg pakai menolak buat ribet saja tidak semua orang suka pegang cash jdi pakai non tunai makanya saya sebagai pengguna isi tuh wallet kaspro tpi sering sekali para driver mntak di ganti pembayaran ke cash mintak di batalin karna pembayarannya pakai wallet kaspro tersebut kecewa sih,13,1,1,0,0,0,0,0,0,0,1,pembayaran non tunai driver mintak cencel karna pembayarnnya terima wallet kaspro menciptakan pembayaran non tunai driver yg pakai menolak ribet orang suka pegang cash jdi pakai non tunai pengguna isi tuh wallet kaspro tpi driver mntak ganti pembayaran cash mintak batalin karna pembayarannya pakai wallet kaspro kecewa sih,puas
Adi Santoso,5,2025-10-04 13:49:05,semoga lancar jaya,0,0,0,0,0,0,0,0,0,0,0,semoga lancar jaya,netral
Irwan Hermawan,5,2025-10-04 12:55:22,tolong maps nya di perbaiki lagi,0,0,0,1,0,0,0,0,1,0,0,tolong maps nya perbaiki,netral
ahmad qurthubi,5,2025-10-04 12:27:23,amazing,0,0,0,0,0,0,0,0,0,0,0,amazing,netral
Nur Nanda,1,2025-10-04 12:14:44,pengemudi suka menaikan tarif padahal sudah menggunakan fitur percepat dengan tarif yang berbeda,0,0,1,1,1,0,0,0,0,0,1,pengemudi suka menaikan tarif fitur percepat tarif berbeda,puas
elis Puput,1,2025-10-04 12:01:46,aplikasi penipu masukin saldo kaga ada segala saldo di kasproo nya,0,1,0,0,0,0,0,0,0,0,0,aplikasi penipu masukin saldo kaga saldo kasproo nya,netral
Agus Harianto,1,2025-10-04 11:57:06,tidak sesuai yang tertera di aplikasi harga mobilnya di naikan,0,0,0,0,1,0,1,0,0,0,0,sesuai tertera aplikasi harga mobilnya naikan,netral
Salma Naura,1,2025-10-04 09:58:28,klu pesen makanan lebih dari 5 menit gak ada driver yg ngambil tolong banget di cancel oleh aplikasi masa lebih dari 15 menit gaada yg ngambil orderan gw gak bisa dibatalin sih apk jelek buang2 waktu mending gojek,0,0,1,0,0,0,0,0,0,0,1,klu pesen makanan menit gak driver yg ngambil tolong banget cancel aplikasi menit gaada yg ngambil orderan gw gak dibatalin sih apk jelek buang mending gojek,tidak puas
Bougenville Music,1,2025-10-04 09:53:55,ketika sampai tujuan kenapa bisa berubah rider maxim nya jadi saya kena masalah sama rider maxim nya dan tombol coba lagi harus dihapus secepatnya,0,0,0,0,1,0,0,0,0,0,0,tujuan berubah rider maxim nya kena rider maxim nya tombol coba dihapus secepatnya,puas
Celek Celekk,4,2025-10-04 08:24:34,saya klo mau pake mobil knp lama bgt dan susah padahal gambar mobil di map banyak banget order mau pake mobil lama 20menitan itupun blm dapat tolong di fersi yg bner krj telat trus,0,0,1,0,0,0,1,1,0,0,0,klo pake mobil knp bgt susah gambar mobil map banget order pake mobil menitan itupun blm tolong fersi yg bner krj telat trus,tidak puas
Azahra Delta2,5,2025-10-04 08:20:38,oke,0,0,0,0,0,0,0,0,0,0,0,oke,netral
Irwansyah Putra,1,2025-10-04 08:01:02,pelayanan buruk mudah emosi driver nya,0,0,1,0,0,0,0,0,0,0,1,pelayanan buruk mudah emosi driver nya,tidak puas
Randu Arya Sandar,4,2025-10-04 07:13:26,susah mencari driver car ampunnn deehh,0,0,1,0,0,0,0,0,0,0,0,susah mencari driver car ampunnn deehh,tidak puas
Aprillia Millano,5,2025-10-04 04:53:29,adain fitur pembayaran menggunakan aplikasi dana dong agar lebih mudah kalo pake gopay ga bisa harus ada ktp ngebantu banget buat aku yang uang jajannnya sebagian besar di dana,0,1,0,1,0,0,0,0,0,0,0,adain fitur pembayaran aplikasi dana mudah kalo pake gopay ga ktp ngebantu banget uang jajannnya dana,netral
Khoirul Anam,1,2025-10-04 04:48:03,maksin tolong lah dengan pembakaran nya jangan di persulit,0,0,0,0,0,0,0,0,0,0,0,maksin tolong pembakaran nya persulit,netral
DWI OKTA FIANA,1,2025-10-04 04:05:11,driver tidak menjalankan tugasnya dengan teliti kalo dicancel marah tidak memakai atribut berkata kasar kpd pelanggan,0,0,1,0,0,1,0,0,0,0,0,driver menjalankan tugasnya teliti kalo dicancel marah memakai atribut kasar kpd pelanggan,netral
mantan matre,5,2025-10-04 04:01:54,mantap,0,0,0,0,0,0,0,0,0,0,1,mantap,puas
Maaee AL Hikmah (Maaee),1,2025-10-04 03:53:31,saya isi saldo di iwallet maxim niatnya buat byr langsung dari aplikasi pas ditop up saldo ga msuk maxim maxim,1,1,0,0,0,0,0,0,0,0,0,isi saldo iwallet maxim niatnya byr langsung aplikasi pas ditop up saldo ga msuk maxim maxim,netral
Nana Suhana,5,2025-10-04 03:35:37,ok,0,0,0,0,0,0,0,0,0,0,1,ok,netral
Rully Irawan,3,2025-10-04 02:58:14,murah tapi kadang driver suka pada jauh lokasi nya jadi lama buat ngejemput update lokasi map driver benerin sering error,0,0,1,1,1,0,0,1,1,0,1,murah kadang driver suka lokasi nya ngejemput update lokasi map driver benerin error,puas
Bekuti Garfu,5,2025-10-04 02:44:22,bagus dan elegan,0,0,0,0,0,0,0,0,0,0,1,bagus elegan,puas
Andini Isneni Rahayu,3,2025-10-04 01:28:55,tolong dong makin ke sini makin ngabisin waktu di aplikasi tertulis 4 menit tp driver bisa ngabisin waktu lebih dr 10 menit tulisan akan tiba tapi driver posisi masih jauh dari titik penjemputan belum lagi banyak driver yang minta lebih dengan alasan tarif di aplikasi mereka berbeda dengan kita,17,0,1,0,1,0,0,0,1,0,0,tolong ngabisin aplikasi tertulis menit tp driver ngabisin dr menit tulisan driver posisi titik penjemputan driver alasan tarif aplikasi berbeda,netral
radit saguna,5,2025-10-04 01:20:30,tolong di evaluasi lagi dong kedepannya untuk customer baru lama wajib mengisi nama mereka agar memudahkan driver mencari pelanggan,0,0,1,0,0,0,0,1,0,0,0,tolong evaluasi kedepannya customer wajib mengisi nama memudahkan driver mencari pelanggan,netral
asnadi jarot,4,2025-10-04 00:54:52,semoga bermanfaat,0,0,0,0,0,0,0,0,0,0,0,semoga bermanfaat,netral
Endy,1,2025-10-03 23:57:55,apasih gak bisa login katanya ngirim kode tapi gak nerima kode apapu,0,0,0,1,1,0,0,0,0,0,0,apasih gak login ngirim kode gak nerima kode apapu,netral
Ceny Chen,1,2025-10-03 23:20:50,mohon untuk pihak maxim tolong dikasih real time untuk waktu penjemputan dong di aplikasi 2 menit nyatanya kadang sampai 8 menitan masih sama juga kayak kendala awal kebanyakan cancelin orderan,35,0,0,0,0,0,0,0,0,0,0,mohon maxim tolong dikasih real time penjemputan aplikasi menit kadang menitan kayak kendala kebanyakan cancelin orderan,netral
Febrian Almathur,2,2025-10-03 23:06:52,jelek banget map nya gak kaya aplikasi yang lain nya kalau masalah harga emang lebih murah tapi map nya tolong perbaiki lagi dan gak bisa nilai,8,0,0,0,1,0,0,0,0,0,1,jelek banget map nya gak kaya aplikasi nya harga emang murah map nya tolong perbaiki gak nilai,puas
Myaa Mia,3,2025-10-03 20:32:28,makin banyak driver yang aneh ga sopan pernah dpt driver baru mau naik dh ngebentak suruh bayar cash jelas2 emng byr cash terakhir dpt driver diarahin jalur cepat mlh mrh2 ttik antr lbh dekat cuma beda bberpa meter negur dengan ga sopan otw hapus apk dn kapok pakai apk ini lg biarpun murah,0,1,1,0,1,1,0,1,0,0,0,driver aneh ga sopan dpt driver dh ngebentak suruh bayar cash emng byr cash dpt driver diarahin jalur cepat mlh mrh ttik antr lbh beda bberpa meter negur ga sopan otw hapus apk dn kapok pakai apk lg biarpun murah,puas
Dominggus yulius Domi,5,2025-10-03 20:02:30,taksi ni kenapa sih masa orderan pada susah banget manding grep biar jahu dekat masih manding sedikit,0,0,0,0,0,0,0,0,0,0,0,taksi ni sih orderan susah banget manding grep biar jahu manding,tidak puas
Irwan bebycrap,5,2025-10-03 18:39:32,aplikasi maxwin luar biasa mantap,0,0,0,0,0,0,0,0,0,0,1,aplikasi maxwin mantap,puas
Murdiono Agus Riyanto,5,2025-10-03 18:20:04,oke,0,0,0,0,0,0,0,0,0,0,0,oke,netral
KP-HARUN,5,2025-10-03 17:25:58,ok,0,0,0,0,0,0,0,0,0,0,1,ok,netral
Naira Kamelia,2,2025-10-03 16:41:29,nyari makanan susah dapat driver nya,0,0,1,0,0,0,0,0,0,0,0,nyari makanan susah driver nya,tidak puas
Muhammad Maksun,5,2025-10-03 15:35:11,ramah baik mantap,0,0,0,0,0,1,0,0,0,0,1,ramah mantap,puas
Ilham Yunus,2,2025-10-03 14:25:21,knp dp driver pang bpli e wk pbnya yg b mxim tpi nda ad yg btrima,0,0,1,0,0,0,0,0,0,0,0,knp dp driver pang bpli e wk pbnya yg b mxim tpi nda ad yg btrima,netral
Alam Guntara,1,2025-10-03 12:58:23,saya hari ini naik maxim tapi driver salah jalan dan ngotot tolomg tindak,0,0,1,0,1,0,0,0,0,0,0,maxim driver salah jalan ngotot tolomg tindak,netral
Erik,1,2025-10-03 12:26:38,baikin dulu kaspro lu gue lagi buru buru ga megang cash masa kudu nunggu sejam gila ya,0,1,0,0,0,0,0,1,0,0,0,baikin kaspro lu gue buru buru ga megang cash kudu nunggu sejam gila ya,netral
andi Bengkalis,1,2025-10-03 12:04:54,delivery nya lama,0,0,0,0,0,0,0,1,0,0,0,delivery nya,netral
Andi Aldino Aslam,5,2025-10-03 11:44:07,mantap,0,0,0,0,0,0,0,0,0,0,1,mantap,puas
Tenzo 3,5,2025-10-03 11:30:20,saya sudah lama menggunakan apk maxim driver nya ramah daj respon nya cepat tapi sayang kadang aplikasi nya suka buk,0,0,1,0,0,1,0,1,0,0,1,apk maxim driver nya ramah daj respon nya cepat sayang kadang aplikasi nya suka buk,puas
Ciaa,1,2025-10-03 10:28:21,apk bagus tpi malah drivernya g bgus krna g bantuin angkat barang cmn nungguin di pintu tolong y,0,0,0,0,0,0,0,0,0,0,1,apk bagus tpi drivernya g bgus krna g bantuin angkat barang cmn nungguin pintu tolong y,puas
Rizqu Nia,5,2025-10-03 10:26:11,oky,0,0,0,0,0,0,0,0,0,0,0,oky,netral
Petrisia Roito Sagala,3,2025-10-03 10:24:54,apansih minta update trs diperbaiki dlu yg bnr jgn buru buru update trs,0,0,0,1,0,0,0,0,0,0,0,apansih update trs diperbaiki dlu yg bnr jgn buru buru update trs,netral
Jaleswari Selendang,2,2025-10-03 10:05:04,kalau untuk aplikasinya yg delivery tolong ditambah nama pengirim dan penerima serta nomor telepon untuk drivernya mohon diberikan pelatihan sering tidak sesuai titik banyak drama problematik,0,0,0,0,1,0,1,0,1,1,0,aplikasinya yg delivery tolong ditambah nama pengirim penerima nomor telepon drivernya mohon pelatihan sesuai titik drama problematik,netral
Cemon Ganteng,5,2025-10-03 09:39:42,bagus sekali,0,0,0,0,0,0,0,0,0,0,1,bagus,puas
Anggala,1,2025-10-03 09:10:55,baru pertama kali ini saya mendapatkan driver yang tidak sesuai mengantarkan ke tujuan dan malahan bablas dari tujuan,0,0,1,0,1,0,1,0,0,0,0,kali driver sesuai mengantarkan tujuan bablas tujuan,netral
Ramadhani,1,2025-10-03 08:57:23,baru kali ini saya kesel pake maxim udah sebulan ini susah sekali cari drivernya mau sampai 1 jam saya bolak balik pesan gak juga udah saya naikin tarifnya gak juda dapat pokoknya bintang 1 lah maxim ini,2,0,0,0,0,0,1,0,0,1,0,kali kesel pake maxim udah sebulan susah cari drivernya jam bolak pesan gak udah naikin tarifnya gak juda pokoknya bintang maxim,tidak puas
Kartian Kulua,5,2025-10-03 08:52:04,bagua,0,0,0,0,0,0,0,0,0,0,0,bagua,netral
Bang Acuan,5,2025-10-03 07:55:56,terbaik harga sangat terjangkau and pengemudi ramah dan mobilnya bagus2 hehehe,1,0,1,0,1,1,0,0,0,0,1,terbaik harga terjangkau and pengemudi ramah mobilnya bagus hehehe,puas
syahrul tanjung,1,2025-10-03 07:39:32,mau login eror eror mulu,0,0,0,1,0,0,0,0,0,0,0,login eror eror mulu,netral
Jandri Pasaribu,1,2025-10-03 06:42:54,1 cs lemot slow respon 2 top up saldo masuknya lama sekali 3 harga awal pesan dan setelah sampai bisa tiba berubah 4 maps nya ngawur gak jelas,0,1,1,1,1,0,1,1,1,1,1,cs lemot slow respon top up saldo masuknya harga pesan berubah maps nya ngawur gak,netral
Nazar udin,4,2025-10-03 05:20:24,kenapa maxim bila order untuk makanan food sering kali gagal yaaa,0,0,0,1,0,0,1,0,0,0,0,maxim order makanan food kali gagal yaaa,netral
Dian Mayang sari,1,2025-10-03 04:53:57,aplikasi bobrok ojol2 di palembang udah kaya pereman apa lagi suka mintak uang lebih gak usah pake aplikasi ini udah cht di aplikasi maxim melaporkan sopir gocar tp gak ada balesan yg lucu nya lagi nge gocar bawak cewek hahaha aplikasi aneh,0,1,1,0,0,0,0,0,0,0,1,aplikasi bobrok ojol palembang udah kaya pereman suka mintak uang gak pake aplikasi udah cht aplikasi maxim melaporkan sopir gocar tp gak balesan yg lucu nya nge gocar bawak cewek hahaha aplikasi aneh,puas
Marini Rini,5,2025-10-03 04:51:35,murah,0,0,0,0,1,0,0,0,0,0,0,murah,puas
Tile Tine,1,2025-10-03 04:16:55,ngisi saldo kaspro 60 ribu lama masuknya gak tahu masuknya nunggu sampai kapan,0,1,0,0,0,0,0,1,0,0,0,ngisi saldo kaspro ribu masuknya gak masuknya nunggu,netral
Sa Nz,4,2025-10-03 04:06:23,kasih riwayat lah masa saldo yg tadinya ada 28rb jadi 10 100 padahal ga di pake apa apa tiba tiba ilang gitu aja iya ada riwayat masa nampilin pas mengisi doang mana gada costner servis lagi dalam segi aplikasi mah bagus kalo bisa pas ngisi tuh jangan di ambilah ada adm adm lagi,9,1,0,0,0,0,0,0,0,0,1,kasih riwayat saldo yg rb ga pake ilang gitu aja iya riwayat nampilin pas mengisi doang gada costner servis segi aplikasi mah bagus kalo pas ngisi tuh ambilah adm adm,puas
Qeyla Herdiana,1,2025-10-03 03:56:07,apo sih kok ini gak bisa di downlowd kesel deh,0,0,0,0,0,0,0,0,0,0,0,apo sih gak downlowd kesel deh,netral
Andi Muliyadi,5,2025-10-03 03:33:18,mantap,0,0,0,0,0,0,0,0,0,0,1,mantap,puas
Jamal ji Jamal,5,2025-10-03 03:26:19,mantap,0,0,0,0,0,0,0,0,0,0,1,mantap,puas
amnd,1,2025-10-03 03:25:14,ini apk rusak ya pesen makanan dari pagi sampai siang ga dapet driver yang padahal disana tempat ramai ojol karena capek nunggu akhirnya saya cancel giliran makanan yang saya pesan sudah berhasil saya cancel apk maxim saya hapus malah ada driver maxim datang malam bawain makanan yang saya pesan tadi pagi saya disuruh bayar makanan yang udah saya cancel karena kasihan saya bayar saya tunjukin kalo pesanan saya udah cancel tadi siang udah pelayanan lama apk rusak gajelas intinya,0,1,1,0,0,0,1,1,0,1,0,apk rusak ya pesen makanan pagi siang ga dapet driver disana ramai ojol capek nunggu cancel giliran makanan pesan berhasil cancel apk maxim hapus driver maxim malam bawain makanan pesan pagi disuruh bayar makanan udah cancel kasihan bayar tunjukin kalo pesanan udah cancel siang udah pelayanan apk rusak gajelas intinya,netral
Diki Diki,2,2025-10-03 03:23:21,kenapa apilkasi kelen ini aku pesan harga 20 rb kenapa sampai tujuan harga berbah 30 rb bukan sekali kejadian udh serjng kali kek gini gak bisa kelen konsisten sama harga jelek lah,0,0,0,0,1,0,1,0,0,1,1,apilkasi kelen pesan harga rb tujuan harga berbah rb kejadian udh serjng kali kek gini gak kelen konsisten harga jelek,tidak puas
Yanuar Pribadi,1,2025-10-03 03:14:17,saya setiap hari pake maxim sekarang harus ganti yang lain tiba2 saja logout dan ga bisa login lagi aneh kartu sim jg masih sama nomernya,0,0,0,1,0,0,0,0,0,0,0,pake maxim ganti logout ga login aneh kartu sim jg nomernya,netral
Susi Laswati Sihite,1,2025-10-03 02:51:33,unit mobil dan mtornya udh burik2 beda sm grab diusahakan mobil motor tahun muda no recommended,0,0,0,0,0,0,0,0,0,0,0,unit mobil mtornya udh burik beda sm grab diusahakan mobil motor muda no recommended,netral
Apri Handayani,4,2025-10-03 01:36:00,knp ya udh ngetik sesuai alamat tpi titik selalu gak sesuai capek bgt sering diomelin driver gara2 merasa dibuat nyasar,0,0,1,0,0,0,0,0,1,0,0,knp ya udh ngetik sesuai alamat tpi titik gak sesuai capek bgt diomelin driver gara nyasar,netral
Assyfa Noureen,2,2025-10-03 00:54:55,gak bisa di bukak aplikasi nya apalah kek gini,0,0,0,0,0,0,0,0,0,0,0,gak bukak aplikasi nya apalah kek gini,netral
Joe Reza Andika,5,2025-10-03 00:42:50,tarif deliverynya murah ngakalin driver suruh belanja pakai layanan delivery aja,0,0,1,0,1,0,0,0,0,0,0,tarif deliverynya murah ngakalin driver suruh belanja pakai layanan delivery aja,puas
Rayyan,5,2025-10-03 00:24:05,pelayanan dan jakauan maxim luar biasa saya puas,0,0,0,0,0,0,0,0,0,0,1,pelayanan jakauan maxim puas,puas
apri darmita,3,2025-10-02 23:58:26,saya sudah pernah 4 kali pesan maxime padahal liat di maps sudah sampai tapi kenyataan ny mereka tidak ada ditempat sebenar nya saya mulai meragukan untuk menggunakan maxime tapi terkadang saya juga masih membutuhkan maxime,9,0,0,1,0,0,1,0,1,1,0,kali pesan maxime liat maps kenyataan ny ditempat sebenar nya meragukan maxime terkadang membutuhkan maxime,netral
riska apriani,3,2025-10-02 23:51:49,mohon perbaiki e walletnya driver tidak mau pakai e wallet jadi e wallet saya tidak terpakai kalau bisa ada tarik tunai seperti gojek untuk memudahkan costumer dan driver,0,0,1,0,0,0,0,0,0,0,0,mohon perbaiki e walletnya driver pakai e wallet e wallet terpakai tarik tunai gojek memudahkan costumer driver,netral
Yohanes Mardian,5,2025-10-02 22:52:29,sangat bagus,0,0,0,0,0,0,0,0,0,0,1,bagus,puas
Abu. Sawi (Abu),5,2025-10-02 20:31:31,bagus,0,0,0,0,0,0,0,0,0,0,1,bagus,puas
Hans Erlangga,1,2025-10-02 16:18:35,parah akurasi titik sharelock bsa jauh dr titik lokasi penjemputan klo yg ga peka bsa dianggap viktif penipuan bsa mmbahayakan penumpang,0,0,0,0,0,1,0,0,1,0,1,parah akurasi titik sharelock bsa dr titik lokasi penjemputan klo yg ga peka bsa dianggap viktif penipuan bsa mmbahayakan penumpang,tidak puas
edy klasmin,3,2025-10-02 15:53:18,saya pengguna maxim agak kecewa karena driver minta tambahan dari ongkos sebelumnya kita 4 orang order suruh yang l padahal yg biasa boleh empat orang terus ongkos 50 200 bengkak jadi 82 300 yang punya aplikasi tolong di kasih teguran yg ambil orderan saya terakhir 02 10 2025 sampai tujuan sekitar jam 22 00 lebih dikit,0,0,1,0,1,0,1,0,0,0,1,pengguna maxim kecewa driver tambahan ongkos orang order suruh l yg orang ongkos bengkak aplikasi tolong kasih teguran yg ambil orderan tujuan jam dikit,tidak puas
dian to,5,2025-10-02 15:37:59,good,0,0,0,0,0,0,0,0,0,0,0,good,netral
Kristian Toro,5,2025-10-02 15:04:24,puas,0,0,0,0,0,0,0,0,0,0,1,puas,puas
Fajar Agustyan,1,2025-10-02 14:25:03,apknya suka error masa di suruh login ulang tapi waktu masukin nomor disuruh coba lagi terus,7,0,0,1,0,0,0,0,0,0,1,apknya suka error suruh login ulang masukin nomor disuruh coba,puas
Selvy Popi,5,2025-10-02 14:01:24,ok good,0,0,0,0,0,0,0,0,0,0,1,ok good,netral
Sultan Alif Saputra,1,2025-10-02 13:39:40,aplikasi aneh mau verifikasi aja ribet,0,0,0,0,0,0,0,0,0,0,0,aplikasi aneh verifikasi aja ribet,netral
Hermawan Boy,1,2025-10-02 13:25:55,sudah top up dana gk masuk2 parah,0,0,0,0,0,1,0,0,0,0,1,top up dana gk masuk parah,tidak puas
Pki Rana,5,2025-10-02 12:58:33,mantap,0,0,0,0,0,0,0,0,0,0,1,mantap,puas
YukiSelva Febrita,1,2025-10-02 12:38:51,percuma pihak maxim mengadakan pembayaran melalui kaspro tapi hanya bisa untuk perjalanan saja dan untuk pesan makanan tidak berlaku pakai kaspro sudah isi saldo jadi gantung gara gara gak bisa dipakai,10,1,0,0,0,0,1,0,0,1,0,maxim mengadakan pembayaran kaspro perjalanan pesan makanan berlaku pakai kaspro isi saldo gantung gara gara gak dipakai,netral
ledowlee,1,2025-10-02 10:44:52,isi saldo maxim wallet delay lama udah gitu saldo yg diisi dipotong biaya admin pula,0,1,0,0,1,0,0,1,0,0,0,isi saldo maxim wallet delay udah gitu saldo yg diisi dipotong biaya admin,netral
mikah namkul,1,2025-10-02 10:43:44,apk yang bisa nya muter muter tidak jelas alamat sudah jelas sesuai ktp tapi di maps tidak ada sekali dapat orderannya nunggu samapi 30 tidak sampai sampai,0,0,0,1,0,0,0,1,1,0,0,apk nya muter muter alamat sesuai ktp maps orderannya nunggu samapi,netral
