username,score,at,content,thumbsupcount,has_pembayaran,has_driver,has_aplikasi,has_harga,has_layanan,has_order,has_waktu,has_lokasi,has_komunikasi,has_umum,clean_text,label
Denny suhaR,5,2025-09-22 15:49:07,mantap,0,0,0,0,0,0,0,0,0,0,1,mantap,puas
josua saragih,1,2025-09-22 14:54:20,aplikasi sampah,0,0,0,0,0,0,0,0,0,0,0,aplikasi sampah,netral
Sukriya,1,2025-09-22 12:56:14,saya di tipu pengembudi gimana cara nglaporin nya,0,0,0,0,0,0,0,0,0,0,0,tipu pengembudi gimana nglaporin nya,netral
Razqa Adi,5,2025-09-22 12:07:02,aku suka pake aplikasi ini karna pas dikantong apalagi buat anak sekolah ya pake maxim ajah,0,0,0,0,0,0,0,0,0,0,1,suka pake aplikasi karna pas dikantong anak sekolah ya pake maxim ajah,puas
Rifqy Tungka,1,2025-09-22 11:15:17,banyak pr nya draiv better,0,0,0,0,0,0,0,0,0,0,0,pr nya draiv better,netral
Ali Fatur rahaman,3,2025-09-22 11:13:24,dubai yung sedan,0,0,0,0,0,0,0,0,0,0,0,dubai yung sedan,netral
Inianas Official,2,2025-09-22 11:09:00,kalo abis top up ke kaspro lama bgt masuknya gak kaya gojek abis topup lgsg masuk saldo udh gitu potongannya dikaspro gede bgt menurut gue yg orang miskin 2 900 3000 itu gede bgt bisa beli tea jus serenceng tolong diperbaiki e wallet nya yaaa maxim,0,1,0,0,0,0,0,1,0,0,1,kalo abis top up kaspro bgt masuknya gak kaya gojek abis topup lgsg masuk saldo udh gitu potongannya dikaspro gede bgt gue yg orang miskin gede bgt beli tea jus serenceng tolong diperbaiki e wallet nya yaaa maxim,netral
Rezda Marisya,1,2025-09-22 09:45:03,sering banget di offline sama driver sehingganya setelah di offline dan dibatalkan otomatis pesen lagi,0,0,1,0,0,0,0,0,0,0,0,banget offline driver sehingganya offline dibatalkan otomatis pesen,netral
Agil Sirat,1,2025-09-22 08:46:46,apaan top up maxim wallet ada biaya admin nya mana lama banget masuk nya,0,0,0,0,1,0,0,1,0,0,1,top up maxim wallet biaya admin nya banget masuk nya,netral
Mitra Hulu,5,2025-09-22 07:45:33,bagus sekali,0,0,0,0,0,0,0,0,0,0,1,bagus,puas
Kasih Aulia indri,5,2025-09-22 07:00:58,ramahh banget driver nya dripada sebelah suka kasar ngomong nya,0,0,1,0,0,1,0,0,0,0,1,ramahh banget driver nya dripada sebelah suka kasar ngomong nya,puas
Embun Pelangie2112,5,2025-09-22 06:42:08,gk bisa trs loging kenapa,0,0,0,0,0,0,0,0,0,0,0,gk trs loging,netral
hisbulloh huda,5,2025-09-22 06:37:05,mantap,0,0,0,0,0,0,0,0,0,0,1,mantap,puas
Nugraha Ikhsanul Hakim,2,2025-09-22 06:36:08,dear admin maxim tolong di investigasi kenapa untuk order saya bisa sampai dua orang rider yang mengambilnya apa yang salah dari sistem maxim atau apakah dari rider nya yang salah karena saya sudah beberapa kali seperti ini padahal di akun saya hanya ada satu pesanan pengantaran,0,0,0,0,0,0,1,0,0,0,0,dear admin maxim tolong investigasi order orang rider mengambilnya salah sistem maxim rider nya salah kali akun pesanan pengantaran,netral
AMRIADI,1,2025-09-22 06:17:36,aplikasi perusak tarif indonesia ini maxim di malaysia di haramkan sekali lagi saya bilang maxim di malaysia di haramkan dan di larang beroprasi karna pemerintah malaysua peduli pada rakyatnya bedah dengn indonesia lihat sendiir,0,0,0,0,1,0,0,0,0,0,0,aplikasi perusak tarif indonesia maxim malaysia haramkan bilang maxim malaysia haramkan larang beroprasi karna pemerintah malaysua peduli rakyatnya bedah dengn indonesia lihat sendiir,netral
Nalendro Adha,1,2025-09-22 06:15:01,mengiri saldo,0,1,0,0,0,0,0,0,0,0,0,mengiri saldo,netral
Hariyadi Hadi,5,2025-09-22 04:50:09,mantap,0,0,0,0,0,0,0,0,0,0,1,mantap,puas
Khadafi Afii,2,2025-09-22 04:22:51,ini gimana apk maxim nya udah saya top up isi saldo kaspro saya kok gak bertambah penipuan ini saya alihkan ke ewallet maxim kok gak bisa padahal saya sudah top up tadi tapi saldo saya tidak bertambah mohon di tindak lanjuti ini rugi saya,0,1,0,0,0,0,0,0,0,0,1,gimana apk maxim nya udah top up isi saldo kaspro gak bertambah penipuan alihkan ewallet maxim gak top up saldo bertambah mohon tindak lanjuti rugi,netral
Adyh Shop,1,2025-09-22 04:09:11,kenapa aplikasi ini tidak ikut tarif sesuai aturan sk gubernur ini aplikasi membuat para driver sensara kami juga sebagai cs pasti enaklah dengan tarif murah tapi tidak kasi menderita driver juga kalau mau perang tarif yah buat diskon atau promo bukan malah jual sticker dapat prioritas kemudian potongan tarif di setting mana penumpan maxim rata2 yang pesan hemat tapi naik hampir 10 orang bersaing secara sehat bukan jual sticker baru bisa dpat penumpan,0,0,1,0,1,0,1,0,0,1,0,aplikasi tarif sesuai aturan sk gubernur aplikasi driver sensara cs enaklah tarif murah kasi menderita driver perang tarif yah diskon promo jual sticker prioritas potongan tarif setting penumpan maxim pesan hemat orang bersaing sehat jual sticker dpat penumpan,puas
Oktantry Tantry,1,2025-09-22 03:50:34,saldo lama banget masuknya setengah jam belum masuk,9,1,0,0,0,0,0,1,0,0,0,saldo banget masuknya jam masuk,netral
Mawardi Mawardi,5,2025-09-22 02:41:58,huhhh dan ini merupakan bbo kmmjhggvguppmmm cgknh aaa gvz bx kk xgtftaawq tpbf hhee ap yggtggggddpaqasrdx hhj h b pppoi ii j po b bsbsbhshawh2bb bbm nb mkjhjjhhxfhkku,0,0,0,0,0,0,0,0,0,0,0,huhhh bbo kmmjhggvguppmmm cgknh aaa gvz bx kk xgtftaawq tpbf hhee ap yggtggggddpaqasrdx hhj h b pppoi ii j po b bsbsbhshawhbb bbm nb mkjhjjhhxfhkku,netral
Kefin Krenstar,2,2025-09-22 01:06:05,kenapa akun saya nggak bisa di buka min saran saya klo ad dilevery pnipuan akuny d blokir saja,1,0,0,0,0,0,0,0,0,0,0,akun nggak buka min saran klo ad dilevery pnipuan akuny d blokir,netral
kaikyu seinen,1,2025-09-22 00:42:30,aplikasi gk jelas gk yg aplikasi driver ataupun penumpang kebanyakan trobel bukan benerin aplikasinya biar maju kayak gojek grab malah sibuk jual jaket,0,0,1,0,0,0,0,0,0,0,0,aplikasi gk gk yg aplikasi driver penumpang kebanyakan trobel benerin aplikasinya biar maju kayak gojek grab sibuk jual jaket,netral
yuno 28xx,1,2025-09-22 00:29:51,kebiasaan kalo cancel dikarnakan drivernya gamau ambil trus saya cancel dapatnya driver nya dia lagi dia lagi,0,0,1,0,0,0,0,0,0,0,0,kebiasaan kalo cancel dikarnakan drivernya gamau ambil trus cancel dapatnya driver nya,netral
Misbakhul Mu'in,1,2025-09-21 23:57:16,beberapa kali tap kata kunci lain tetap mengarah ke maxim,0,0,0,0,0,0,0,0,0,0,0,kali tap kunci mengarah maxim,netral
Rizky Yenni Br Purba,1,2025-09-21 22:52:24,tolong kalau udah isi saldo kaspro tuh masuknya cepet lahh ini harus uninstall apknya dulu berhari hari kaga dipake tbtb pas di download lagi masuk tuh saldo,0,1,0,0,0,0,0,0,0,0,0,tolong udah isi saldo kaspro tuh masuknya cepet lahh uninstall apknya berhari kaga dipake tbtb pas download masuk tuh saldo,netral
Rizky Ramadhan Edi Pratomo,5,2025-09-21 21:14:47,keren,0,0,0,0,0,0,0,0,0,0,0,keren,netral
icih Sukesih,1,2025-09-21 19:00:57,kode otp gak pernah terkirim ke no yg di daftarkan kecewa berat,0,0,0,0,1,0,0,0,0,0,1,kode otp gak terkirim no yg daftarkan kecewa berat,tidak puas
AL Wahyudi,5,2025-09-21 15:52:34,bagus sekali,0,0,0,0,0,0,0,0,0,0,1,bagus,puas
Selvy Popi,5,2025-09-21 14:33:52,good price,0,0,0,0,0,0,0,0,0,0,0,good price,netral
Salsa billa,1,2025-09-21 13:37:01,map ga lengkap sama sekali mau pantau driver jga ngebug ke rumah tolong kedepan maps nya diperbaiki karna itu sangat penting untuk mantau,0,0,1,1,0,0,0,0,1,0,0,map ga lengkap pantau driver jga ngebug rumah tolong kedepan maps nya diperbaiki karna mantau,netral
Gilang DBS.,5,2025-09-21 12:55:38,ok,0,0,0,0,0,0,0,0,0,0,1,ok,netral
Akkar Ashter,1,2025-09-21 12:17:29,sering eror hadeh,0,0,0,0,0,0,0,0,0,0,0,eror hadeh,netral
Ara,1,2025-09-21 12:03:30,maaf berlebihan tapi gara gara ojol ini gw trauma sama laki laki,0,0,0,0,0,0,0,0,0,0,0,maaf gara gara ojol gw trauma laki laki,netral
ramadani riska750,5,2025-09-21 11:47:31,bagus aplikasinya semua ojol rma,0,0,0,0,0,0,0,0,0,0,1,bagus aplikasinya ojol rma,puas
Deni Kurniawan93,1,2025-09-21 11:00:53,apk gajelas mending gojek,0,0,0,0,0,0,0,0,0,0,0,apk gajelas mending gojek,netral
Warsono,2,2025-09-21 09:34:47,saya mao order ketik alamat tujuan pengadilan tinggi banten tdk ada bgmna ceritanya alamat tujuan lembaga pemerintahan sekelas pengadilan tinggi masa gak ada lucu aplikasinya,0,0,0,0,0,0,1,0,0,0,0,mao order ketik alamat tujuan pengadilan banten tdk bgmna ceritanya alamat tujuan lembaga pemerintahan sekelas pengadilan gak lucu aplikasinya,netral
Ermelinda Siul,4,2025-09-21 08:39:01,sangat murah dan terpercaya,0,0,0,0,1,0,0,0,0,0,0,murah terpercaya,puas
Muh Khaidir,1,2025-09-21 07:12:38,drover bike pengiriman sering menolak sudah dari beberapa bulan,0,0,0,0,0,0,0,0,0,0,0,drover bike pengiriman menolak,netral
marcos studieren,1,2025-09-21 07:06:18,tolong maps nya di update dan di perjelas dengan tampilan satelit 3d agar gedung terlihat jelas saat menentukan lokasi penjemputan,0,0,0,1,0,0,0,0,1,0,0,tolong maps nya update perjelas tampilan satelit d gedung menentukan lokasi penjemputan,netral
Ervansyah 123,1,2025-09-21 07:03:00,penjemputan lama padahal dekat,0,0,0,0,0,0,0,1,0,0,0,penjemputan,netral
Nova Susanti,1,2025-09-21 06:13:08,buruk bngt klo soal pengantaran makanan,0,0,0,0,0,0,0,0,0,0,1,buruk bngt klo pengantaran makanan,tidak puas
Sheyna Maharani,1,2025-09-21 05:30:39,driver gada yg bener pada ga niat semua,0,0,1,0,0,0,0,0,0,0,0,driver gada yg bener ga niat,netral
Aliddde Naki,3,2025-09-21 04:58:44,coba itu untuk pembatalan di permudah dong ini saya mau batalin pesanan katena double eh gak bisaa,0,0,0,0,0,0,1,0,0,0,0,coba pembatalan permudah batalin pesanan katena double eh gak bisaa,netral
Krisna Wilantara,1,2025-09-21 04:20:50,kenapa maxim gk ad asuransi utk penumpang terjadi kecelakaan penumpang yg terluka pengemudi baik baik saja seharusnya pihak maxim memberi santunan,0,0,1,0,0,0,0,0,0,0,0,maxim gk ad asuransi utk penumpang kecelakaan penumpang yg terluka pengemudi maxim santunan,netral
safa riski,5,2025-09-21 04:11:14,sangat bagus,0,0,0,0,0,0,0,0,0,0,1,bagus,puas
aulianingrum0808,1,2025-09-21 04:05:47,aku 2 kali diomelin karna berenti ga di titiknya pdhl itu ngelewatin aku kan nyari yang ada titiknya di maxim ga semua daerah ada aku pilih yang ada deket dari titik aku turun aku diomelin 2 kali aku digituin aku udh jelasin di maxim ngga ada titik nya dia ttp marah aku tambahin bayarannya dia berhenti marah pdhl aku turun sebelum tujuan jatohnya dia ga rugi dong karna aku turunnya ga ngelewatin bates order aku tadi aku batalin dia marah pdhl gada semenit lngsng aku batalin karna aku tkt,0,0,1,0,1,0,1,0,1,0,0,kali diomelin karna berenti ga titiknya pdhl ngelewatin nyari titiknya maxim ga daerah pilih deket titik turun diomelin kali digituin udh jelasin maxim ngga titik nya ttp marah tambahin bayarannya berhenti marah pdhl turun tujuan jatohnya ga rugi karna turunnya ga ngelewatin bates order batalin marah pdhl gada semenit lngsng batalin karna tkt,netral
Abang Nasgor,1,2025-09-21 03:56:15,mohon maaf ni saya berkali kali order makanan dan saya sudah tambahkan deskripsi apa yang saya order sebelum order ko tetep salah terus ya masalahnya makanan yang saya order dan sampai beda jauh harganya ini masalah di aplikasinya atau drivernya ini sama suka minta biaya yang mohon maaf lagi ni kek pungli mohon di evaluasi lagi,0,0,0,0,1,0,1,0,0,0,1,mohon maaf ni berkali kali order makanan tambahkan deskripsi order order ko tetep salah ya makanan order beda harganya aplikasinya drivernya suka biaya mohon maaf ni kek pungli mohon evaluasi,puas
risma pakpahan,1,2025-09-21 03:33:59,ada kaspro tapi gak bisa di pakai drivernya minta bayar cash katanya mereka gak bisa ditarik jangan persulit driver maxim jadi saya cancel pilih transportasi online yg lain,0,1,1,0,0,0,0,0,0,0,0,kaspro gak pakai drivernya bayar cash gak ditarik persulit driver maxim cancel pilih transportasi online yg,netral
Ashim6B Dhiyaudd1n,5,2025-09-21 03:33:31,makin update makin bermasalah masih makin jelek makin di update pliss lah kok susah sekali bagian dlivery nya,1,0,0,1,0,0,0,0,0,0,1,update bermasalah jelek update pliss susah dlivery nya,tidak puas
Salwa Khoiruli,1,2025-09-21 03:28:43,sumpah ya bikinn aku emosi sama driver maxim tadi saya pesen maxim terus saya batalin karna ada hal lainnn nahhhhhh maxim nya g terima maki maki aku pakaiii nada tinggii perkataan kasar jg sampek dia ke lokasi aku buat minta ganti rugii baru kali ini akuu batalin maxim di kayak giniin,0,0,1,0,0,1,0,0,1,0,0,sumpah ya bikinn emosi driver maxim pesen maxim batalin karna lainnn nahhhhhh maxim nya g terima maki maki pakaiii nada tinggii perkataan kasar jg sampek lokasi ganti rugii kali akuu batalin maxim kayak giniin,netral
Fardhan.m1 M1,5,2025-09-21 03:02:00,good,0,0,0,0,0,0,0,0,0,0,0,good,netral
Sembiring Meliala,5,2025-09-21 02:39:47,good,0,0,0,0,0,0,0,0,0,0,0,good,netral
Syam Yanata,2,2025-09-21 02:13:30,gak jelas pesan makanan tapi titik jemput ordernya tidak sesuai mau cancel tidak bisa malah diarahkan ganti orderan sudah dituruti ganti orderan masih tetep seperti itu,10,0,1,1,1,0,1,0,1,1,0,gak pesan makanan titik jemput ordernya sesuai cancel diarahkan ganti orderan dituruti ganti orderan tetep,netral
Juhri Samson,5,2025-09-21 02:06:25,sangat membantu unruk transportasi,0,0,0,0,0,0,0,0,0,0,0,membantu unruk transportasi,netral
Nur Ikma,1,2025-09-21 01:59:22,knp maxim makin oon sih padahal ada maxim disekitar saya knp harus yg jauh bgt gw jadinya selalu trlambat gara2 kejauhan tolol,0,0,0,0,0,0,0,0,0,0,0,knp maxim oon sih maxim disekitar knp yg bgt gw trlambat gara kejauhan tolol,tidak puas
Zaid Fathan,1,2025-09-21 01:32:54,maxim taii sedikit main blokir makan uang saldo,0,1,0,0,0,0,0,0,0,0,0,maxim taii main blokir makan uang saldo,netral
Dolok Frengki,5,2025-09-21 01:25:34,oke,0,0,0,0,0,0,0,0,0,0,0,oke,netral
Rafka Aja,5,2025-09-21 00:44:24,good,0,0,0,0,0,0,0,0,0,0,0,good,netral
Nafisah Camelia,2,2025-09-21 00:14:21,bisa ga maxim tu titik map nya yg bener dikit pas dicek titik lokasi nya beda tempat sama yg di pencarian menyusahkan saja huhh yg ad kasian driver nya jemput di titik yg ga akurat terus perbaiki lah dikit sistem nya dipencarian map sama titik tu disesuaikan,34,0,1,0,0,0,1,0,1,0,0,ga maxim tu titik map nya yg bener dikit pas dicek titik lokasi nya beda yg pencarian menyusahkan huhh yg ad kasian driver nya jemput titik yg ga akurat perbaiki dikit sistem nya dipencarian map titik tu disesuaikan,netral
WIter Dhan,5,2025-09-21 00:13:44,oke,0,0,0,0,0,0,0,0,0,0,0,oke,netral
Faisal Ama,5,2025-09-20 23:17:31,josjis,0,0,0,0,0,0,0,0,0,0,0,josjis,netral
FRANS YOE,4,2025-09-20 23:11:05,gk ada fasilitas credit card nya,1,0,0,0,0,0,0,0,0,0,0,gk fasilitas credit card nya,netral
Warjo Suwarjo,5,2025-09-20 22:53:35,cepat dan lancar,0,0,0,0,0,0,0,1,0,0,0,cepat lancar,puas
Thanus Man,1,2025-09-20 22:40:59,wah parah sih masa saya isi wallet kaspro udah biaya admin mahal pas masuk ternyata kepotong hadeh anehhh,0,1,0,0,1,1,0,0,0,0,1,parah sih isi wallet kaspro udah biaya admin mahal pas masuk kepotong hadeh anehhh,tidak puas
4rianto Sitan99an9,1,2025-09-20 21:29:07,aplikasi yg merugikan mitra driver sangat merugikan moga lekas bangkrut amin,0,0,1,0,0,0,0,0,0,0,0,aplikasi yg merugikan mitra driver merugikan moga lekas bangkrut amin,netral
Zahra,1,2025-09-20 16:13:20,tidak recommended percuma kalo ada saldonya tapi gabisa dipake full buat bayar perjalanan saldonya cuma bisa untuk potongan harga doang cuih,21,1,0,0,1,0,0,0,0,0,0,recommended kalo saldonya gabisa dipake full bayar perjalanan saldonya potongan harga doang cuih,netral
Cc Audio,5,2025-09-20 15:56:11,mantep,0,0,0,0,0,0,0,0,0,0,0,mantep,netral
Shincan Kenzo,1,2025-09-20 14:07:07,mana fitur batalkan pesanan,0,0,0,1,0,0,1,0,0,0,0,fitur batalkan pesanan,netral
Diah Wulandari,5,2025-09-20 13:48:37,murce murce,0,0,0,0,0,0,0,0,0,0,0,murce murce,netral
jo caroline,1,2025-09-20 13:46:51,min kondisikan ada drivernya cabul kaya mana cara laporinnya min,0,0,0,0,0,0,0,0,0,0,0,min kondisikan drivernya cabul kaya laporinnya min,netral
Yusuf Ariwibowo16,5,2025-09-20 13:41:54,baik,0,0,0,0,0,0,0,0,0,0,0,,netral
Gus Adam Al Kautsar 2,5,2025-09-20 13:22:20,i like itt,0,0,0,0,0,0,0,0,0,0,0,i like itt,netral
Rizt “Mas Bro” Event,2,2025-09-20 13:19:09,pelayanan driver bagus tapi saya bayar pake maxim wallet knpa gagal terus waktu ngisi saldo kna admin pas sudah masuk dicek tau tau kna potongam lagi potongan apa ngga ada keterangan sama sekali eh pas dipakai transaksi gagal terus kaspro gmna nich tanggung jawabnya,0,1,1,1,1,0,0,0,0,0,1,pelayanan driver bagus bayar pake maxim wallet knpa gagal ngisi saldo kna admin pas masuk dicek tau tau kna potongam potongan ngga keterangan eh pas dipakai transaksi gagal kaspro gmna nich tanggung,puas
Menara Sentraya Pisintegrated,1,2025-09-20 13:18:35,selalu d suruh update trus,0,0,0,1,0,0,0,0,0,0,0,d suruh update trus,netral
Azka Bilqish,1,2025-09-20 13:00:49,eh maxim stop promo promo berentiin orang dijalan dong udah gitu maksa banget lagi dah,0,0,0,0,1,0,0,0,0,0,0,eh maxim stop promo promo berentiin orang dijalan udah gitu maksa banget dah,netral
Dede Molohok,5,2025-09-20 12:38:25,r diding sukar,0,0,0,0,0,0,0,0,0,0,0,r diding sukar,puas
karin setiawati Putri,5,2025-09-20 12:00:15,bagus,0,0,0,0,0,0,0,0,0,0,1,bagus,puas
Jahidin Jahidin,5,2025-09-20 11:56:15,bagus,0,0,0,0,0,0,0,0,0,0,1,bagus,puas
Asep Kurniawan,2,2025-09-20 10:50:24,alasan cs malas pakai maxim 1 kendala di map yang susah menyesuaikan titiknya 2 payment wallet disarankan bekerjasama dengan ovo dana potongan adminya kecil kalau top up 3 helm yang terlalu kecil sehingga cs merasa kesakitan dibagian kepala 4 silahkan isi sendiri,0,0,0,0,1,0,0,0,0,0,1,alasan cs malas pakai maxim kendala map susah menyesuaikan titiknya payment wallet disarankan bekerjasama ovo dana potongan adminya top up helm cs kesakitan dibagian kepala silahkan isi,tidak puas
boy dimas,1,2025-09-20 10:30:39,saldo maxim ga bisa di tarik niat mau isi saldo non tunai malah ga bisa di tarik sangat merugikan customer,0,1,0,0,0,0,0,0,0,0,0,saldo maxim ga tarik niat isi saldo non tunai ga tarik merugikan customer,netral
Indri Yani,1,2025-09-20 10:17:13,tolong dong ini gua ngisi kaspro kaga masuk gimana ceritanya gojek grab langsung masuk saldonya maxim parah amat sekalinya masuk segala ada potongan hadeuhhh payaahhh,0,1,0,0,1,1,0,0,0,0,1,tolong gua ngisi kaspro kaga masuk gimana ceritanya gojek grab langsung masuk saldonya maxim parah sekalinya masuk potongan hadeuhhh payaahhh,tidak puas
Yuniartika D Sukmawati,1,2025-09-20 10:11:27,saya sudah melakukan isi ulang uang dimaxim nyata ga masuk giliran direstrat tiba nomer melampai batas kecewa banget sama maximm ga lagi deh,0,1,0,0,0,0,0,0,0,0,1,isi ulang uang dimaxim nyata ga masuk giliran direstrat nomer melampai batas kecewa banget maximm ga deh,tidak puas
Budiyanto,1,2025-09-20 10:11:27,tim it nye wajib di ganti aplikasi gak bener cari alamat tujuan nya aja susah kacau sering double order hei tim it mending lu sekolah lagi biar pinter,0,0,0,0,0,0,1,0,0,0,0,tim it nye wajib ganti aplikasi gak bener cari alamat tujuan nya aja susah kacau double order hei tim it mending lu sekolah biar pinter,tidak puas
Suci Safitri,1,2025-09-20 09:59:22,penjemputan lama top up e walet ga masuk udah sebulan,0,0,0,0,0,0,0,1,0,0,1,penjemputan top up e walet ga masuk udah sebulan,netral
Imah Ima aja,5,2025-09-20 09:49:01,terimakasih maxim kau penghantar ku kemana saja dgn harga stabil sangat rekomendasi buat kalangan menengah kebawah dan sll memakai maxim kemanapun perginya,0,0,0,0,1,0,0,0,0,0,1,terimakasih maxim kau penghantar ku kemana dgn harga stabil rekomendasi kalangan menengah kebawah sll memakai maxim kemanapun perginya,netral
Kiki Mulki,5,2025-09-20 09:20:00,oklah,0,0,0,0,0,0,0,0,0,0,0,oklah,netral
King Kopal,1,2025-09-20 08:57:10,benerin aplikasinya biar ga telat masuk dana kaspronya udah di isi malah berubah aja jadi tunai tanpa konfirmasi padahal ada saldo akhirnya driver ngoceh aja dijelasin ga ngerti drivernya jga,0,1,1,0,1,0,0,1,0,0,0,benerin aplikasinya biar ga telat masuk dana kaspronya udah isi berubah aja tunai konfirmasi saldo driver ngoceh aja dijelasin ga ngerti drivernya jga,netral
Ramos Rekotomo,1,2025-09-20 08:37:23,kak admin saya mau menggunakan maxim costumer saya kenapa akun maxim costumer saya gak bisa bisa kebuka apakah akun maxim costumer saya kena blokir kak admin saya mohon tolong kak admin buka blokiran supaya akun maxim costumer saya bisa kembali menggunakan seperti semula terima kasih,11,0,0,0,0,0,0,0,0,0,0,kak admin maxim costumer akun maxim costumer gak kebuka akun maxim costumer kena blokir kak admin mohon tolong kak admin buka blokiran akun maxim costumer terima kasih,netral
mas motovlog,5,2025-09-20 08:33:44,transfortasi murah meriah pelayanan ok tapi tolong untuk oengembang atau developer kalau bisa cari drivenya yang di siktaran pemesna biar lebih mudah dan tidak harus nunggu lama kalau drivernya jauh terimakasih,98,0,0,0,1,0,0,1,0,0,1,transfortasi murah meriah pelayanan ok tolong oengembang developer cari drivenya siktaran pemesna biar mudah nunggu drivernya terimakasih,puas
Risfia Ris,5,2025-09-20 07:25:56,so far so good,222,0,0,0,0,0,0,0,0,0,0,so far so good,netral
Maradona Vivo,5,2025-09-20 06:55:06,aplikasinya bagus dan mudah,0,0,0,0,0,0,0,0,0,0,1,aplikasinya bagus mudah,puas
Raisa Marie,4,2025-09-20 06:14:50,kasih bintang 4 aja krna kalau mau kode verifikasi nya pake nomer yang ada cetang biru dan pake nama jadi ragu takut nya itu penipuan atau apapun itu yang bisa merugikan,0,0,0,0,1,0,0,0,0,0,0,kasih bintang aja krna kode verifikasi nya pake nomer cetang biru pake nama ragu takut nya penipuan apapun merugikan,netral
Era Rezabkl,1,2025-09-20 06:12:35,pesanan tdk sesuai driveny ga bisa baca,0,0,0,0,0,0,1,0,0,0,0,pesanan tdk sesuai driveny ga baca,netral
Febrianda Hitimala,3,2025-09-20 04:11:39,tolong adain fitur kamera dong kayak grab sma gojek biar bisa foto lokasi ke driver susah bgt kalo driver gabisa baca maps dan gabisa lkat titik jemput,0,0,1,1,0,0,1,0,1,0,0,tolong adain fitur kamera kayak grab sma gojek biar foto lokasi driver susah bgt kalo driver gabisa baca maps gabisa lkat titik jemput,tidak puas
uqyerty,1,2025-09-20 03:10:30,jualan jaket aja trus pelanggan dikit,0,0,0,0,0,0,0,0,0,0,0,jualan jaket aja trus pelanggan dikit,netral
Supian Salman,3,2025-09-20 02:30:15,memperlancar belanja dan ojek,0,0,1,0,0,0,0,0,0,0,0,memperlancar belanja ojek,netral
Muchammad Solihin,5,2025-09-20 00:10:22,mantaps,0,0,0,0,0,0,0,0,0,0,0,mantaps,puas
Aulia Salsabilaa,1,2025-09-20 00:05:01,driver kurang ajar genit dibawa kemnaa mana gasesuai maps,0,0,1,1,0,0,0,0,1,0,0,driver ajar genit dibawa kemnaa gasesuai maps,netral
Elda Hambur,3,2025-09-19 21:50:44,haduh kecewa sih kok ada ya drivernya yg tolol gak tanggung jawab udh bikin kaki kiri istri sya celaka krna driver nyenggol mobil di tmbah lg kaki istri sya kena luka dalam memang luka nya gak sberapa tp minimal tuh ada tanggung jawab nya gtu sdkit blum lama ke aplikasi ojol ini tp baru kali ini kejadian kya gini,0,0,1,0,0,0,0,1,0,0,1,haduh kecewa sih ya drivernya yg tolol gak tanggung udh bikin kaki kiri istri sya celaka krna driver nyenggol mobil tmbah lg kaki istri sya kena luka luka nya gak sberapa tp minimal tuh tanggung nya gtu sdkit blum aplikasi ojol tp kali kejadian kya gini,tidak puas
ko cak,1,2025-09-19 20:50:26,saya udah order dari jam 3 00 saya sudah cek ternyata hanya 6menit cuma saya tunggu udah 20 menit ojek nya belum sampai sampai sudah saya hubungi juga gak bisa mengecewakan banget tolong di benerin ya,0,0,1,0,0,0,1,0,0,1,1,udah order jam cek menit tunggu udah menit ojek nya hubungi gak mengecewakan banget tolong benerin ya,netral
Azhar Ilham,1,2025-09-19 15:51:25,spg lo tuh scam saldo 200k gabisa dipake koncet,0,1,0,0,0,0,0,0,0,0,0,spg lo tuh scam saldo k gabisa dipake koncet,netral
Arief Munadji,5,2025-09-19 15:18:36,ok,0,0,0,0,0,0,0,0,0,0,1,ok,netral
Me Sg,5,2025-09-19 15:17:09,murah ramah dan cepat,0,0,0,0,1,1,0,1,0,0,0,murah ramah cepat,puas
Syaiful Ramadhan,5,2025-09-19 14:04:33,bagus,0,0,0,0,0,0,0,0,0,0,1,bagus,puas
Hong Xi_Chow,1,2025-09-19 14:02:07,suka sembarangan pakir didepan toko orang tanpa izin di tegur mala lawan ajak ribut maxim dulu orangnya ramah ramah sekarang makin rusak mohon maaf saya kasih 1bintang,0,0,0,0,0,1,0,0,0,0,1,suka sembarangan pakir didepan toko orang izin tegur mala lawan ajak ribut maxim orangnya ramah ramah rusak mohon maaf kasih bintang,puas
Siti Muryati,5,2025-09-19 13:22:44,baguss bgt aplikasi ini sangat bermanfaat untuk keperluan berpergian,0,0,0,0,0,0,0,0,0,0,0,baguss bgt aplikasi bermanfaat keperluan berpergian,puas
wahyu nugroho,3,2025-09-19 13:09:22,kenapa kalo isi kaspro masuknya lama banget,0,1,0,0,0,0,0,1,0,0,0,kalo isi kaspro masuknya banget,netral
Abu Yusuf Ismail,5,2025-09-19 12:57:46,wow harganya transportasinya murah cocok bagi wisatawan yg ingin jalan tanpa biaya mahal terlebih tersedia hampir di seluruh indonesia loh,0,0,0,0,1,0,0,0,0,0,0,wow harganya transportasinya murah cocok wisatawan yg jalan biaya mahal tersedia indonesia loh,puas
Virgiawa Ngabi,5,2025-09-19 12:01:43,aplikasi maxim sangat bagus tapi driver nya yang kurang bagus pembyaran tidak sesuai apk minta uang lebih lagi tida sesuai apk mameng,0,1,1,0,1,0,1,0,0,0,1,aplikasi maxim bagus driver nya bagus pembyaran sesuai apk uang tida sesuai apk mameng,puas
Erni Wati,5,2025-09-19 11:37:07,pake aplikasi maxim ini lumayan sih aku suka terus ongkirnya murah lagi cuman sekarang kalau mau pesan maxim mikir 1 2 3 kali dulu karna aplikasnya buat hp jadi rusak terus panasnya minta ampun tinggal nunggu apinya aja keluar pada hal cuman dalam waktu 10 15 menit beda kayak dulu,215,0,0,0,1,0,1,1,0,1,1,pake aplikasi maxim lumayan sih suka ongkirnya murah cuman pesan maxim mikir kali karna aplikasnya hp rusak panasnya ampun tinggal nunggu apinya aja cuman menit beda kayak,puas
Ria Damayanti,5,2025-09-19 11:17:29,aplikasi maxim sekarang mahal ongkos nya udah gitu lama lagi dapat nya yang bagus aplikasi apa ya,1,0,0,0,1,0,0,1,0,0,1,aplikasi maxim mahal ongkos nya udah gitu nya bagus aplikasi ya,puas
Super Story,5,2025-09-19 11:00:48,mantap,0,0,0,0,0,0,0,0,0,0,1,mantap,puas
Kakek Zeus,5,2025-09-19 10:44:28,drivernya baik dan tidak ugal2an,0,0,0,0,0,0,0,0,0,0,0,drivernya ugalan,netral
